{
  "$schema": "http://json-schema.org/draft-07/schema#",
  "$id": "https://iii-drone.invalid/schemas/v1/build-policy.schema.json",
  "type": "object", "additionalProperties": false,
  "required": ["schema", "version", "target_definition", "layout", "release_install", "activation_root", "python_site_packages", "release_wrapper", "forbidden_output_directories", "forbidden_path_fragments", "release_assets", "host_elf_allowlist", "host_library_prefixes", "components", "interface_packages", "normal_build_transports", "target_package_manager_allowed"],
  "properties": {
    "schema": {"const": "iii.build-policy/v1"}, "version": {"const": 1},
    "target_definition": {"const": "deployment/targets/v1/raspberry-pi-5-noble-arm64.json"},
    "layout": {"const": "isolated-colcon"}, "release_install": {"const": "install"},
    "activation_root": {"const": "/opt/iii/current"},
    "python_site_packages": {"const": "python/cp312/site-packages"},
    "release_wrapper": {"const": "bin/iii-release-env"},
    "forbidden_output_directories": {"type": "array", "minItems": 1, "uniqueItems": true, "items": {"type": "string"}},
    "forbidden_path_fragments": {"type": "array", "minItems": 1, "uniqueItems": true, "items": {"type": "string"}},
    "release_assets": {"type": "array", "minItems": 1, "uniqueItems": true, "items": {"$ref": "#/definitions/release_asset"}},
    "host_elf_allowlist": {"type": "array", "minItems": 1, "uniqueItems": true, "items": {"type": "string", "pattern": "^[A-Za-z0-9_.+-]+\\.so(?:\\.[A-Za-z0-9_.+-]+)*$"}},
    "host_library_prefixes": {"const": ["/opt/ros/jazzy"]},
    "components": {"type": "object", "additionalProperties": false, "required": ["drone", "gc"], "properties": {"drone": {"type": "array", "minItems": 1, "uniqueItems": true, "items": {"type": "string"}}, "gc": {"type": "array", "minItems": 1, "uniqueItems": true, "items": {"type": "string"}}}},
    "interface_packages": {"type": "array", "minItems": 1, "uniqueItems": true, "items": {"type": "string"}},
    "normal_build_transports": {"const": ["local-docker"]},
    "target_package_manager_allowed": {"const": false}
  },
  "definitions": {
    "release_asset": {
      "type": "object", "additionalProperties": false,
      "required": ["source", "package", "relative"],
      "properties": {
        "source": {"type": "string", "pattern": "^src/[A-Za-z0-9._/-]+$"},
        "package": {"type": "string", "pattern": "^[a-z][a-z0-9_]+$"},
        "relative": {"type": "string", "pattern": "^[A-Za-z0-9._-]+(?:/[A-Za-z0-9._-]+)*$"}
      }
    }
  }
}
