{
  "schema": "iii.build-policy/v1",
  "version": 1,
  "target_definition": "deployment/targets/v1/raspberry-pi-5-noble-arm64.json",
  "layout": "isolated-colcon",
  "release_install": "install",
  "activation_root": "/opt/iii/current",
  "python_site_packages": "python/cp312/site-packages",
  "release_wrapper": "bin/iii-release-env",
  "forbidden_output_directories": ["src", "build", "log", ".git", "runtime"],
  "forbidden_path_fragments": ["/home/iii/ws", "/home/ffn/Workspace", "/opt/iii/sysroot"],
  "release_assets": [
    {
      "source": "src/iwr6843aop-ROS2-pkg/cfg_files",
      "package": "iwr6843aop_pub",
      "relative": "cfg_files"
    }
  ],
  "host_elf_allowlist": [
    "ld-linux-aarch64.so.1",
    "libGLX.so.0",
    "libGLdispatch.so.0",
    "libIex-3_1.so.30",
    "libIlmThread-3_1.so.30",
    "libImath-3_1.so.29",
    "libLerc.so.4",
    "libOpenEXR-3_1.so.30",
    "libX11.so.6",
    "libXau.so.6",
    "libXdmcp.so.6",
    "libaec.so.0",
    "libarmadillo.so.12",
    "libarpack.so.2",
    "libblas.so.3",
    "libblosc.so.1",
    "libbrotlicommon.so.1",
    "libbrotlidec.so.1",
    "libbsd.so.0",
    "libbz2.so.1.0",
    "libc.so.6",
    "libcfitsio.so.10",
    "libcharls.so.2",
    "libcom_err.so.2",
    "libcrypto.so.3",
    "libcurl-gnutls.so.4",
    "libcurl.so.4",
    "libdeflate.so.0",
    "libdfalt.so.0",
    "libdl.so.2",
    "libexpat.so.1",
    "libffi.so.8",
    "libfmt.so.9",
    "libfontconfig.so.1",
    "libfreetype.so.6",
    "libfreexl.so.1",
    "libfyba.so.0",
    "libfygm.so.0",
    "libfyut.so.0",
    "libgcc_s.so.1",
    "libgdal.so.34",
    "libgdcmCommon.so.3.0",
    "libgdcmDICT.so.3.0",
    "libgdcmDSED.so.3.0",
    "libgdcmIOD.so.3.0",
    "libgdcmMSFF.so.3.0",
    "libgdcmjpeg12.so.3.0",
    "libgdcmjpeg16.so.3.0",
    "libgdcmjpeg8.so.3.0",
    "libgeos.so.3.12.1",
    "libgeos_c.so.1",
    "libgeotiff.so.5",
    "libgfortran.so.5",
    "libgif.so.7",
    "libgmp.so.10",
    "libgnutls.so.30",
    "libgssapi_krb5.so.2",
    "libhdf5_serial.so.103",
    "libhdf5_serial_hl.so.100",
    "libheif.so.1",
    "libhogweed.so.6",
    "libicudata.so.74",
    "libicuuc.so.74",
    "libidn2.so.0",
    "libjbig.so.0",
    "libjpeg.so.8",
    "libjson-c.so.5",
    "libk5crypto.so.3",
    "libkeyutils.so.1",
    "libkmlbase.so.1",
    "libkmldom.so.1",
    "libkmlengine.so.1",
    "libkrb5.so.3",
    "libkrb5support.so.0",
    "liblapack.so.3",
    "liblber.so.2",
    "liblcms2.so.2",
    "libldap.so.2",
    "libltdl.so.7",
    "liblttng-ust-common.so.1",
    "liblttng-ust-tracepoint.so.1",
    "liblttng-ust.so.1",
    "liblz4.so.1",
    "liblzma.so.5",
    "libm.so.6",
    "libmd.so.0",
    "libmfhdfalt.so.0",
    "libminizip.so.1",
    "libmysqlclient.so.21",
    "libnetcdf.so.19",
    "libnettle.so.8",
    "libnghttp2.so.14",
    "libnspr4.so",
    "libnss3.so",
    "libnssutil3.so",
    "libnuma.so.1",
    "libodbc.so.2",
    "libodbcinst.so.2",
    "libogdi.so.4.1",
    "libopencv_core.so.406",
    "libopencv_imgcodecs.so.406",
    "libopencv_imgproc.so.406",
    "libopenjp2.so.7",
    "liborocos-kdl.so.1.5",
    "libp11-kit.so.0",
    "libpcre2-8.so.0",
    "libplc4.so",
    "libplds4.so",
    "libpng16.so.16",
    "libpoppler.so.134",
    "libpq.so.5",
    "libproj.so.25",
    "libpsl.so.5",
    "libpthread.so.0",
    "libpython3.12.so.1.0",
    "libqhull_r.so.8.0",
    "libresolv.so.2",
    "librt.so.1",
    "librtmp.so.1",
    "librttopo.so.1",
    "libsasl2.so.2",
    "libsharpyuv.so.0",
    "libsmime3.so",
    "libsnappy.so.1",
    "libspatialite.so.8",
    "libspdlog.so.1.12",
    "libsqlite3.so.0",
    "libssh.so.4",
    "libssl.so.3",
    "libstdc++.so.6",
    "libsuperlu.so.6",
    "libsz.so.2",
    "libtasn1.so.6",
    "libtbb.so.12",
    "libtiff.so.6",
    "libtinyxml2.so.10",
    "libtirpc.so.3",
    "libunistring.so.5",
    "liburiparser.so.1",
    "libuuid.so.1",
    "libwebp.so.7",
    "libxcb.so.1",
    "libxerces-c-3.2.so",
    "libxml2.so.2",
    "libyaml-0.so.2",
    "libyaml-cpp.so.0.8",
    "libz.so.1",
    "libzstd.so.1"
  ],
  "host_library_prefixes": ["/opt/ros/jazzy"],
  "components": {
    "drone": ["iii_drone_configuration", "iii_drone_contracts", "iii_drone_core", "iii_drone_interfaces", "iii_drone_mission", "iii_drone_runtime", "iii_drone_supervision"],
    "gc": ["iii_drone_contracts", "iii_drone_gc"]
  },
  "interface_packages": ["iii_drone_interfaces", "iii_drone_contracts"],
  "normal_build_transports": ["local-docker"],
  "target_package_manager_allowed": false
}
